{
  "schema_version": "0.1.0",
  "calibration_id": "synthetic-legacy-identity-v1",
  "provenance": {
    "method": "historical_identity_replay_not_empirical_calibration",
    "sample_count": 0,
    "validation_count": 0
  },
  "input_bounds": {
    "latency_ms": {
      "minimum": 0,
      "maximum": 300000
    },
    "cost_units": {
      "minimum": 0,
      "maximum": 100
    },
    "safety_risk": {
      "minimum": 0,
      "maximum": 1
    }
  },
  "transforms": {
    "latency_ms": {
      "scale": 1,
      "offset": 0
    },
    "cost_units": {
      "scale": 1,
      "offset": 0
    },
    "safety_risk": {
      "slope": 1,
      "intercept": 0
    }
  },
  "model_influence": {
    "latency_ms": 1,
    "cost_units": 1,
    "safety_risk": 1
  },
  "operation_priors": {
    "*": {
      "latency_ms": 0,
      "cost_units": 0,
      "safety_risk": 0
    }
  }
}
